<?xml version="1.0" encoding="ISO-8859-1"?>

<!DOCTYPE report-config 
	PUBLIC "-//CODE-AON//DTD Report Config//EN" 
	"http://co-de.com/aon/report-config.dtd">

<report-config>

	<!--  **********************************************************
						      ACCOUNTING
		  ********************************************************** -->
	<!--  BALANCE DE PERDIDAS Y GANACIAS -->
	<report id="profitAndLoss" description="ProfitAndLoss">
		<template path="/com/code/aon/ui/accounting/report/profitAndLoss.jasper"/>
		<collection provider="#{profitAndLossReport}"/>
		<params>
			<param id="REPORT_RESOURCE_BUNDLE" value="com.code.aon.ui.accounting.i18n.report" />
			<param id="company" value="#{company.obtainCompany}" />
			<param id="params" value="#{profitAndLossReport.getParameters}" />
			<param id="reportTitle" value="#{profitAndLossReport.getReportTitle}" />
		</params>
	</report>

	<!--  BALANCE MESUAL DE PERDIDAS Y GANACIAS -->
	<report id="profitAndLossMonthly" description="ProfitAndLossMonthly">
		<template path="/com/code/aon/ui/accounting/report/profitAndLossMonthly.jasper"/>
		<collection provider="#{profitAndLossMonthly}"/>
		<params>
			<param id="REPORT_RESOURCE_BUNDLE" value="com.code.aon.ui.accounting.i18n.report" />
			<param id="company" value="#{company.obtainCompany}" />
			<param id="params" value="#{profitAndLossReport.getParameters}" />
		</params>
	</report>

	<!--  BALANCE DE PERDIDAS Y GANACIAS PRESUPUESTADO -->
	<report id="budgetedProfitAndLoss" description="BudgetedProfitAndLoss">
		<template path="/com/code/aon/ui/accounting/report/profitAndLoss.jasper"/>
		<collection provider="#{budgetedProfitAndLossReport}"/>
		<params>
			<param id="REPORT_RESOURCE_BUNDLE" value="com.code.aon.ui.accounting.i18n.report" />
			<param id="company" value="#{company.obtainCompany}" />
			<param id="params" value="#{budgetedProfitAndLossReport.getParameters}" />
			<param id="reportTitle" value="#{budgetedProfitAndLossReport.getReportTitle}" />
		</params>
	</report>
	
	<!--  LISTADO DE CUENTAS CON PRESUPUESTO -->
	<report id="budgetList" description="BudgetList">
		<template path="/com/code/aon/ui/accounting/report/budgetList.jasper"/>
		<bean key="com.code.aon.accounting.AccountBudget" />
		<criteria provider="#{accountBudget}"/>
		<fetch-mode paginated="true" page-count="5000" virtualizer-max-size="1000" />
		<params>
			<param id="REPORT_RESOURCE_BUNDLE" value="com.code.aon.ui.accounting.i18n.report" />
			<param id="company" value="#{company.obtainCompany}" />
			<param id="creditTotal" value="#{accountBudget.getCreditTotal}" />
			<param id="debitTotal" value="#{accountBudget.getDebitTotal}" />
		</params>
	</report>
	
	<!--  BALANCE DE PERDIDAS Y GANACIAS PRESUPUESTADO -->
	<report id="profitAndLossComparison" description="BudgetedProfitAndLoss">
		<template path="/com/code/aon/ui/accounting/report/profitAndLossComparison.jasper"/>
		<collection provider="#{budgetedProfitAndLossComparison.list}"/>
		<params>
			<param id="REPORT_RESOURCE_BUNDLE" value="com.code.aon.ui.accounting.i18n.report" />
			<param id="company" value="#{company.obtainCompany}" />
			<param id="params" value="#{budgetedProfitAndLossReport.getParameters}" />
		</params>
	</report>

	<!--  LISTADO DETALLADO DE CUENTAS CON PRESUPUESTO -->
	<report id="budgetDetailList" description="BudgetDetailList">
		<template path="/com/code/aon/ui/accounting/report/budgetDetailList.jasper"/>
		<bean key="com.code.aon.accounting.AccountBudgetDetail" />
		<criteria provider="#{accountBudgetDetail}"/>
		<fetch-mode paginated="true" page-count="5000" virtualizer-max-size="1000" />
		<params>
			<param id="REPORT_RESOURCE_BUNDLE" value="com.code.aon.ui.accounting.i18n.report" />
			<param id="company" value="#{company.obtainCompany}" />
			<param id="debitTotal" value="#{accountBudget.getDebitTotal}" />
			<param id="monthNames" value="#{accountBudget.getMonthNames()}" />
		</params>
	</report>
	
	<!--  EXTRACTO DE CUENTA -->
	<report id="statement" description="Account Statement">
		<template path="/com/code/aon/ui/accounting/report/statement.jasper"/>
		<collection provider="#{statement}"/>
		<params>
			<param id="REPORT_RESOURCE_BUNDLE" value="com.code.aon.ui.accounting.i18n.report" />
			<param id="company" value="#{company.obtainCompany}" />
			<param id="openingEntry" value="#{statement.getOpeningEntry}" />
			<param id="fromOpeningEntry" value="#{statement.getFromOpeningEntry}" />
			<param id="periodBalance" value="#{statement.getPeriodBalance}" />
			<param id="params" value="#{trialBalance.getParameters}" />
		</params>
	</report>

	<!--  BALANCE DE SUMAS Y SALDOS -->
	<report id="trialBalance" description="trialBalance">
		<template path="/com/code/aon/ui/accounting/report/trialBalance.jasper"/>
		<collection provider="#{trialBalance}"/>
		<params>
			<param id="REPORT_RESOURCE_BUNDLE" value="com.code.aon.ui.accounting.i18n.report" />
			<param id="company" value="#{company.obtainCompany}" />
			<param id="summaryCollection" value="#{trialBalance.getSummaryCollection}" />
			<param id="params" value="#{trialBalance.getParameters}" />
		</params>
	</report>

	<!--  LISTADO DIARIO DE APUNTES -->
	<report id="journalBook" description="Listado Diario de Apuntes">
		<template path="/com/code/aon/ui/accounting/report/journalBook.jasper"/>
		<bean key="com.code.aon.accounting.AccountEntryDetail" />
		<criteria provider="#{journalReport}"/>
		<fetch-mode paginated="true" page-count="5000" virtualizer-max-size="1000" />
		<params>
			<param id="REPORT_RESOURCE_BUNDLE" value="com.code.aon.ui.accounting.i18n.report" />
			<param id="company" value="#{company.obtainCompany}" />
			<param id="fromDate" value="#{journalReport.getFromDate}" />
			<param id="toDate" value="#{journalReport.getToDate}" />
			<param id="date" value="#{journalReport.getDate}" />
			<param id="period" value="#{journalReport.getPeriod}" />
		</params>
	</report>

</report-config>